{
  "$schema": "http://json-schema.org/draft-07/schema#",
  "title": "Card",
  "type": "object",
  "required": ["id", "name", "reward_rules", "constraints"],
  "properties": {
    "id": {"type": "string"},
    "name": {"type": "string"},
    "network": {"type": "string"},
    "reward_rules": {"type": "object"},
    "constraints": {"type": "object"}
  }
}
